### ISSUE TITLE
[Bug] AMF does not handle SCTP stream identifier

### ISSUE THREAD

**Issue by aligungr** [free5gc/free5gc#88]
Hello everyone, I am the maintainer of [UERANSIM](https://github.com/aligungr/UERANSIM), and recently made some improvement on SCTP stream handling. However we could not use your core network for the relevant cause. I think the AMF does not handle streams properly.

Although it may be considered as a missing feature, here is the bug:
AMF does not handle SCTP stream identifier as specified by 3GPP, it always uses "0" as stream identifier.

## To Reproduce
1. Clone https://github.com/aligungr/UERANSIM
2. Set configuration of UERANSIM to free5gc, by modifying config/profile.yaml
3. Run the simulator, trigger initial-registration

## Expected behavior
I am not completely sure, but NgSetupResponse and DownlinkNASTransport should have been sent with different stream numbers since one is non-UE-associated signalling and the other is UE-associated signalling. But the stream identifier is always zero.
For additional information please refer to 3GPP specs such as TS 38.412

## Environment:
 - free5GC Version: v3.0.1
 - OS: Ubuntu 20.04
 - Kernel version: 5.4.0-42-generic
 - go version: 1.14.4
 - c compiler version (Option): gcc 9.3.0

### Configuration File
(not included since the bug is easily reproducible. )

### PCAP File
[sctp_stream.zip](https://github.com/free5gc/free5gc/files/5056248/sctp_stream.zip)

### Log File
(not included since the bug is easily reproducible. )

## Additional context
n/a

**Comment by s5uishida** [comment]
I also tried it, when I look at the line of **`localhost.38412 > localhost.41470`**, it seems like that.
```
root@free5gc05:~# tcpdump -r free5gc.pcap |grep sctp|grep SID
reading from file free5gc.pcap, link-type LINUX_SLL (Linux cooked)
11:08:13.897123 IP localhost.41470 > localhost.38412: sctp (1) [DATA] (B)(E) [TSN: 2960284684] [SID: 1] [SSEQ 0] [PPID 0x3c]                                                                                                                 
11:08:13.906372 IP localhost.38412 > localhost.41470: sctp (1) [DATA] (B)(E) [TSN: 786140333] [SID: 0] [SSEQ 0] [PPID 0x3c]                                                                                                                  
11:08:20.298951 IP localhost.41470 > localhost.38412: sctp (1) [DATA] (B)(E) [TSN: 2960284685] [SID: 1] [SSEQ 1] [PPID 0x3c]                                                                                                                 
11:08:20.492203 IP localhost.38412 > localhost.41470: sctp (1) [SACK] [cum ack 2960284685] [a_rwnd 106496] [#gap acks 0] [#dup tsns 0] , (2) [DATA] (B)(E) [TSN: 786140334] [SID: 0] [SSEQ 1] [PPID 0x3c]                                    
11:08:21.096914 IP localhost.41470 > localhost.38412: sctp (1) [DATA] (B)(E) [TSN: 2960284686] [SID: 1] [SSEQ 2] [PPID 0x3c]                                                                                                                 
11:08:21.200157 IP localhost.38412 > localhost.41470: sctp (1) [SACK] [cum ack 2960284686] [a_rwnd 106496] [#gap acks 0] [#dup tsns 0] , (2) [DATA] (B)(E) [TSN: 786140335] [SID: 0] [SSEQ 2] [PPID 0x3c]                                    
11:08:21.436550 IP localhost.41470 > localhost.38412: sctp (1) [DATA] (B)(E) [TSN: 2960284687] [SID: 1] [SSEQ 3] [PPID 0x3c]                                                                                                                 
11:08:21.751484 IP localhost.38412 > localhost.41470: sctp (1) [DATA] (B)(E) [TSN: 786140336] [SID: 0] [SSEQ 3] [PPID 0x3c]                                                                                                                  
11:08:21.932471 IP localhost.41470 > localhost.38412: sctp (1) [SACK] [cum ack 786140336] [a_rwnd 106496] [#gap acks 0] [#dup tsns 0] , (2) [DATA] (B)(E) [TSN: 2960284688] [SID: 1] [SSEQ 4] [PPID 0x3c]                                    
11:08:22.137431 IP localhost.41470 > localhost.38412: sctp (1) [DATA] (B)(E) [TSN: 2960284689] [SID: 1] [SSEQ 5] [PPID 0x3c] 
````
The environment tested here is as follows.
- free5GC Version: v3.0.3
- OS: Ubuntu 18.04
- Kernel version: 5.0.0-23-generic
- go version: 1.14.4
- c compiler version (Option): gcc version 7.5.0

**Comment by aligungr** [comment]
**Update:** You can now use master branch of UERANSIM. Also since this error avoids free5gc to be used by UERANSIM, I made this error ignorable in our side.

In `/config/free5gc/gnb.yaml` there is an option called `ignoreStreamIds`. You can set this value to `true` in order to ignore this error in gNB side.

**Comment by p1-bmu** [comment]
I would like to emphasize on this issue.
At current time, free5gc is only using SCTP stream id 0 for every NGAP signaling messages. Using the SCTP stream id 0 for non-UE signaling, and > 0 for UE-associated signaling (eventually the RAN-UE-NGAP-ID value), seems a common practice that already existed in 4G. Some applications and gNB implementations are relying on the SCTP stream id to dispatch the signaling messages to the correct handler. Therefore it could be nice to adopt this behavior in free5gc: that would enable a better interoperability.

The exact description related to the handling of SCTP stream ids lies in the TS 38.412, section 7, which is not very explicit unfortunately...

I am running free5gc with the following env:
- free5GC Version: v3.0.5
- OS: Ubuntu 20.04
- Kernel version: 5.4.0-62-generic
- go version: go1.14.4

**Comment by JiMMyMatrix** [comment]
Hello, please upgrade free5gc to latest version v3.3.0, the stream id problem would resolved.
