### ISSUE TITLE
[Bug] More than one PDU session on single UPF

### ISSUE THREAD

**Issue by konradkar2** [free5gc/free5gc#388]
I'm trying to add a second DN to free5gc's default configuration so UE can have 2 PDU sessions and it doesn't seem to work properly.
Both UESIMTUN interfaces are correctly created on UE but on the second one (corresponding to internet2) I can't ping UPF's N3 interface

<details>
  <summary>SMF config</summary>
   
  ```javascript
  info:
  version: 1.0.2
  description: SMF initial local configuration

configuration:
  smfName: SMF # the name of this SMF
  sbi: # Service-based interface information
    scheme: http # the protocol for sbi (http or https)
    registerIPv4: 10.0.123.9 # IP used to register to NRF
    bindingIPv4: 10.0.123.9  # IP used to bind the service
    port: 8000 # Port used to bind the service
    tls: # the local path of TLS key
      key: config/TLS/smf.key # SMF TLS Certificate
      pem: config/TLS/smf.pem # SMF TLS Private key
  serviceNameList: # the SBI services provided by this SMF, refer to TS 29.502
    - nsmf-pdusession # Nsmf_PDUSession service
    - nsmf-event-exposure # Nsmf_EventExposure service
    - nsmf-oam # OAM service
  snssaiInfos: # the S-NSSAI (Single Network Slice Selection Assistance Information) list supported by this AMF
    - sNssai: # S-NSSAI (Single Network Slice Selection Assistance Information)
        sst: 1 # Slice/Service Type (uinteger, range: 0~255)
        sd: 010203 # Slice Differentiator (3 bytes hex string, range: 000000~FFFFFF)
      dnnInfos: # DNN information list
        - dnn: internet # Data Network Name
          dns: # the IP address of DNS
            ipv4: 8.8.8.8
        - dnn: internet2 # Data Network Name
          dns: # the IP address of DNS
            ipv4: 8.8.8.8
    - sNssai: # S-NSSAI (Single Network Slice Selection Assistance Information)
        sst: 1 # Slice/Service Type (uinteger, range: 0~255)
        sd: 112233 # Slice Differentiator (3 bytes hex string, range: 000000~FFFFFF)
      dnnInfos: # DNN information list
        - dnn: internet # Data Network Name
          dns: # the IP address of DNS
            ipv4: 8.8.8.8
  plmnList: # the list of PLMN IDs that this SMF belongs to (optional, remove this key when unnecessary)
    - mcc: "208" # Mobile Country Code (3 digits string, digit: 0~9)
      mnc: "93" # Mobile Network Code (2 or 3 digits string, digit: 0~9)
  locality: area1 # Name of the location where a set of AMF, SMF and UPFs are located
  pfcp: # the IP address of N4 interface on this SMF (PFCP)
    addr: 10.0.140.2
  userplaneInformation: # list of userplane information
    upNodes: # information of userplane node (AN or UPF)
      gNB1: # the name of the node
        type: AN # the type of the node (AN or UPF)
      UPF:  # the name of the node
        type: UPF # the type of the node (AN or UPF)
        nodeID: 10.0.140.1 # the IP/FQDN of N4 interface on this UPF (PFCP)
        sNssaiUpfInfos: # S-NSSAI information list for this UPF
          - sNssai: # S-NSSAI (Single Network Slice Selection Assistance Information)
              sst: 1 # Slice/Service Type (uinteger, range: 0~255)
              sd: 010203 # Slice Differentiator (3 bytes hex string, range: 000000~FFFFFF)
            dnnUpfInfoList: # DNN information list for this S-NSSAI
              - dnn: internet
                pools:
                  - cidr: 10.60.0.0/16
              - dnn: internet2
                pools:
                  - cidr: 10.61.0.0/16
          - sNssai: # S-NSSAI (Single Network Slice Selection Assistance Information)
              sst: 1 # Slice/Service Type (uinteger, range: 0~255)
              sd: 112233 # Slice Differentiator (3 bytes hex string, range: 000000~FFFFFF)
            dnnUpfInfoList: # DNN information list for this S-NSSAI
              - dnn: internet
                pools:
                  - cidr: 10.62.0.0/16
        interfaces: # Interface list for this UPF
          - interfaceType: N3 # the type of the interface (N3 or N9)
            endpoints: # the IP address of this N3/N9 interface on this UPF
              - 10.0.130.1
            networkInstance: internet # Data Network Name (DNN)
          - interfaceType: N3 # the type of the interface (N3 or N9)
            endpoints: # the IP address of this N3/N9 interface on this UPF
              - 10.0.130.1
            networkInstance: internet2 # Data Network Name (DNN)
    links: # the topology graph of userplane, A and B represent the two nodes of each link
      - A: gNB1
        B: UPF
  nrfUri: http://10.0.123.1:8000 # a valid URI of NRF

# the kind of log output
# debugLevel: how detailed to output, value: trace, debug, info, warn, error, fatal, panic
# ReportCaller: enable the caller report or not, value: true or false
logger:
  SMF:
    debugLevel: info
    ReportCaller: false
  NAS:
    debugLevel: info
    ReportCaller: false
  NGAP:
    debugLevel: info
    ReportCaller: false
  Aper:
    debugLevel: info
    ReportCaller: false
  PFCP:
    debugLevel: info
    ReportCaller: false

  ```
</details>

<details>
  <summary>UPF config</summary>
    
  ```javascript
  version: 1.0.3
description: UPF initial local configuration

# The listen IP and nodeID of the N4 interface on this UPF (Can't set to 0.0.0.0)
pfcp:
  addr: 10.0.140.1   # IP addr for listening
  nodeID: 10.0.140.1 # External IP or FQDN can be reached
  retransTimeout: 1s # retransmission timeout
  maxRetrans: 3 # the max number of retransmission

gtpu:
  forwarder: gtp5g
  # The IP list of the N3/N9 interfaces on this UPF
  # If there are multiple connection, set addr to 0.0.0.0 or list all the addresses
  ifList:
    - addr: 10.0.130.1
      type: N3
      # name: upf.5gc.nctu.me
      # ifname: gtpif

# The DNN list supported by UPF
dnnList:
  - dnn: internet # Data Network Name
    cidr: 10.60.0.0/24 # Classless Inter-Domain Routing for assigned IPv4 pool of UE
    # natifname: eth0
  - dnn: internet2 # Data Network Name
    cidr: 10.61.0.0/24 # Classless Inter-Domain Routing for assigned IPv4 pool of UE
    # natifname: eth0

logger: # log output setting
  enable: true # true or false
  level: info # how detailed to output, value: trace, debug, info, warn, error, fatal, panic
  reportCaller: false # enable the caller report or not, value: true or false

  ```
</details>

<details>
  <summary>UE</summary>

  ```javascript
  # IMSI number of the UE. IMSI = [MCC|MNC|MSISDN] (In total 15 digits)
supi: 'imsi-208930000000003'
# Mobile Country Code value of HPLMN
mcc: '208'
# Mobile Network Code value of HPLMN (2 or 3 digits)
mnc: '93'

# Permanent subscription key
key: '8baf473f2f8fd09487cccbd7097c6862'
# Operator code (OP or OPC) of the UE
op: '8e27b6af0e692e750f32667a3b14605d'
# This value specifies the OP type and it can be either 'OP' or 'OPC'
opType: 'OPC'
# Authentication Management Field (AMF) value
amf: '8000'
# IMEI number of the device. It is used if no SUPI is provided
imei: '356938035643803'
# IMEISV number of the device. It is used if no SUPI and IMEI is provided
imeiSv: '4370816125816151'

# List of gNB IP addresses for Radio Link Simulation
gnbSearchList:
  - 10.0.200.1

# UAC Access Identities Configuration
uacAic:
  mps: false
  mcs: false

# UAC Access Control Class
uacAcc:
  normalClass: 0
  class11: false
  class12: false
  class13: false
  class14: false
  class15: false

# Initial PDU sessions to be established
sessions:
  - type: 'IPv4'
    apn: 'internet'
    slice:
      sst: 0x01
      sd: 0x010203
  - type: 'IPv4'
    apn: 'internet2'
    slice:
      sst: 0x01
      sd: 0x010203

# Configured NSSAI for this UE by HPLMN
configured-nssai:
  - sst: 0x01
    sd: 0x010203

# Default Configured NSSAI for this UE
default-nssai:
  - sst: 1
    sd: 1

# Supported integrity algorithms by this UE
integrity:
  IA1: true
  IA2: true
  IA3: true

# Supported encryption algorithms by this UE
ciphering:
  EA1: true
  EA2: true
  EA3: true

# Integrity protection maximum data rate for user plane
integrityMaxRate:
  uplink: 'full'
  downlink: 'full'

  ```

</details>

Do you have any reference showing how it should be done?

**Comment by konradkar2** [comment]
It seems like the a bug inside GTP kernel module.
This is traffic from the second PDU session (UERANSIM1 interface) 

 ~/5g/netns5g  testTwoPduSessionsSingleSlice !1  sudo ip netns exec upf tcpdump -i upfgtp -n                                                                   ok  18:39:26 
tcpdump: verbose output suppressed, use -v or -vv for full protocol decode
listening on upfgtp, link-type RAW (Raw IP), capture size 262144 bytes
18:39:28.905480 IP 10.61.0.1 > 10.1.1.1: ICMP echo request, id 4250, seq 8, length 64
18:39:29.926202 IP 10.61.0.1 > 10.1.1.1: ICMP echo request, id 4250, seq 9, length 64
18:39:30.950641 IP 10.61.0.1 > 10.1.1.1: ICMP echo request, id 4250, seq 10, length 64

UPF's n6 interface with that address is UP
30: upf-n6-1@if29: <BROADCAST,MULTICAST,UP,LOWER_UP> mtu 1500 qdisc noqueue state UP group default qlen 1000
    link/ether ee:5a:7c:73:62:2f brd ff:ff:ff:ff:ff:ff link-netnsid 0
    inet 10.1.1.1/24 scope global upf-n6-1
       valid_lft forever preferred_lft forever

I've also tried adding NAT, and that traffic is also not forwarded
Chain POSTROUTING (policy ACCEPT 22 packets, 1828 bytes)
 pkts bytes target     prot opt in     out     source               destination         
    2   168 MASQUERADE  all  --  any    upf-n6-0  10.60.0.0/16         anywhere            
    0     0 MASQUERADE  all  --  any    upf-n6-1  10.61.0.0/16         anywhere   
    
Seems like GTP kernel module is not forwarding packets to N6 interface, and it only happens for PDU session 2 (internet2).

Tested environment
OS: Ubuntu 20.04, 5.4.0-65-generic
go 1.14.4
free5gc 3.2.0
gtp5g 0.6.2
UERANSIM, commit 5819ee470f6a30e62faf8e56a79cfb09806ccc99
gcc 12.1.0

Also tried with Linux Manjaro, Kernel 5.15.49-1-MANJARO, same result.

**Comment by konradkar2** [comment]
I've located the bug, I'll describe it under different issue.
